### DISCUSSION TITLE
TLS options - restricting ciphers

### DISCUSSION THREAD

**Discussion by amdrsantos** [syslog-ng/syslog-ng#4507] [Q&A]
I tried to restrict the ciphers offered by syslog-ng client in a TLS connection:
```
destination d_tls_tls {
    syslog("10.0.2.5" transport("tls") ip-protocol(4) port(6514) keep-alive(no)
        suppress(5)
        tls(
            ca-dir("/var/security/x509/trusted_certs/")
            cert-file("/var/security/x509/certs/keyStore1.crt")
            key-file("/var/security/x509/keys/keyStore1.key")
            peer-verify(yes)
            cipher-suite("ECDHE-ECDSA-AES256-SHA384")
        )
        disk-buffer(
            mem-buf-length(2000)
            disk-buf-size(8388608)
            dir("/tmp")
        )
    );
};
```
But in the tcpdump I see that the Hello packet offers:
```
Frame 4: 297 bytes on wire (2376 bits), 297 bytes captured (2376 bits)
Ethernet II, Src: 00:5c:4b:ed:46:42 (00:5c:4b:ed:46:42), Dst: PcsCompu_71:95:9d (08:00:27:71:95:9d)
Internet Protocol Version 4, Src: 10.0.2.6, Dst: 10.0.2.5
Transmission Control Protocol, Src Port: 41209, Dst Port: 6514, Seq: 1, Ack: 1, Len: 231
Transport Layer Security
    TLSv1.3 Record Layer: Handshake Protocol: Client Hello
        Content Type: Handshake (22)
        Version: TLS 1.0 (0x0301)
        Length: 226
        Handshake Protocol: Client Hello
            Handshake Type: Client Hello (1)
            Length: 222
            Version: TLS 1.2 (0x0303)
            Random: e8f821230353f8545ec043251d5d8265fccdb4b5f3ce277e898638cb6728495f
            Session ID Length: 32
            Session ID: 656081d6e77651b97a978f07766636dd272993ac346e30eed05d7e41373e4233
            Cipher Suites Length: 10
            Cipher Suites (5 suites)
                Cipher Suite: TLS_AES_256_GCM_SHA384 (0x1302)
                Cipher Suite: TLS_CHACHA20_POLY1305_SHA256 (0x1303)
                Cipher Suite: TLS_AES_128_GCM_SHA256 (0x1301)
                Cipher Suite: TLS_ECDHE_ECDSA_WITH_AES_256_CBC_SHA384 (0xc024)
                Cipher Suite: TLS_EMPTY_RENEGOTIATION_INFO_SCSV (0x00ff)
            Compression Methods Length: 1
            Compression Methods (1 method)
            Extensions Length: 139
            Extension: ec_point_formats (len=4)
            Extension: supported_groups (len=12)
            Extension: session_ticket (len=0)
            Extension: encrypt_then_mac (len=0)
            Extension: extended_master_secret (len=0)
            Extension: signature_algorithms (len=42)
            Extension: supported_versions (len=5)
            Extension: psk_key_exchange_modes (len=2)
            Extension: key_share (len=38)
            [JA3 Fullstring: 771,4866-4867-4865-49188-255,1
```

I needed to add `ssl-options(no-sslv2, no-sslv3, no-tlsv1, no-tlsv11, no-tlsv13)` to the TLS options.
**Is this expected?**
Because in the documentation is says that:

> That way, the cipher-suite() also determines the encryption protocol used in the connection: to disable SSLv3, use an algorithm that is available only in TLSv1.2, and that both the client and the server supports. 

[TLS Options](https://www.syslog-ng.com/technical-documents/doc/syslog-ng-open-source-edition/3.38/administration-guide/73#TOPIC-2026407)
