### ISSUE TITLE
syslog connection accepted and getting closed

### ISSUE THREAD

**Issue by JanakiRamiReddy** [syslog-ng/syslog-ng#2960]
I am having a remote client where the syslog msg sent are properly getting decoded as per the IETF format.
But I am seeing the syslog connection getting accepted and closed very frequently, when using the syslog(), but with tcp() no issue is seen.

I have made to separate log path one for the remote and other for the internal, the below are seen in the internal logs.

**Error logs:**

<45>1 2019-10-04T12:41:10+05:30 embd-lnx syslog-ng 8023 - [meta sequenceId="7"] Syslog connection accepted; fd='20', client='AF_INET(10.64.68.71:14435)', local='AF_INET(0.0.0.0:6514)'
<43>1 2019-10-04T12:41:10+05:30 embd-lnx syslog-ng 8023 - [meta sequenceId="8"] Invalid frame header; header=''
<45>1 2019-10-04T12:41:10+05:30 embd-lnx syslog-ng 8023 - [meta sequenceId="9"] Syslog connection closed; fd='20', client='AF_INET(10.64.68.71:14435)', local='AF_INET(0.0.0.0:6514)'

config file:
```
@version: 3.5
@include "scl.conf"
@include "`scl-root`/system/tty10.conf"

# Syslog-ng configuration file, compatible with default Debian syslogd
# installation.

# First, set some global options.
options { long_hostnames(off); flush_lines(0); use_dns(no); use_fqdn(no);
    owner("root"); group("adm"); perm(0640); stats_freq(0);
    create_dirs(1); bad_hostname("^gconfd$"); #ts-format(iso);
};

########################
# Sources
########################
# This is the default behavior of sysklogd package
# Logs may come from unix stream, but not from another machine.
#
source s_src {
       system();
       internal();
};

# If you wish to get logs from remote machine you should uncomment
# this and comment the above source line.
#
#source s_net { tcp(ip(0.0.0.0) port(1000)); };

source s_net {
#tcp(ip(0.0.0.0) port(6514)
syslog(ip(0.0.0.0) port(6514)
transport("tls")
tls( ca_dir("/etc/syslog-ng/ca.d")
    key_file("/etc/syslog-ng/key.d/privkey.pem")
     cert_file("/etc/syslog-ng/cert.d/cacert.pem")
    peer_verify(optional-untrusted)) ); };

########################
# Remote Destinations
########################

destination d_net_auth { file("/var/log/HOSTS/$HOST/auth.log" flags(syslog-protocol)); };
destination d_net_cron { file("/var/log/HOSTS/$HOST/cron.log" flags(syslog-protocol)); };
destination d_net_daemon { file("/var/log/HOSTS/$HOST/daemon.log" flags(syslog-protocol)); };
destination d_net_kern { file("/var/log/HOSTS/$HOST/kern.log" flags(syslog-protocol)); };
destination d_net_lpr { file("/var/log/HOSTS/$HOST/lpr.log" flags(syslog-protocol)); };
destination d_net_mail { file("/var/log/HOSTS/$HOST/mail.log" flags(syslog-protocol)); };
destination d_net_syslog { file("/var/log/HOSTS/$HOST/syslog.log" flags(syslog-protocol)); };
destination d_net_user { file("/var/log/HOSTS/$HOST/user.log" flags(syslog-protocol)); };
destination d_net_uucp { file("/var/log/HOSTS/$HOST/uucp.log" flags(syslog-protocol)); };

destination d_net_mailinfo { file("/var/log/HOSTS/$HOST/mail/mail.info" flags(syslog-protocol)); };
destination d_net_mailwarn { file("/var/log/HOSTS/$HOST/mail/mail.warn" flags(syslog-protocol)); };
destination d_net_mailerr { file("/var/log/HOSTS/$HOST/mail/mail.err" flags(syslog-protocol)); };

destination d_net_debug { file("/var/log/HOSTS/$HOST/debug" flags(syslog-protocol)); };
destination d_net_error { file("/var/log/HOSTS/$HOST/error" flags(syslog-protocol)); };
destination d_net_messages { file("/var/log/HOSTS/$HOST/messages" flags(syslog-protocol)); };


#Remote Log paths
########################
log { source(s_net); filter(f_auth); destination(d_net_auth); };
log { source(s_net); filter(f_cron); destination(d_net_cron); };
log { source(s_net); filter(f_daemon); destination(d_net_daemon); };
log { source(s_net); filter(f_kern); destination(d_net_kern); };
log { source(s_net); filter(f_lpr); destination(d_net_lpr); };
log { source(s_net); filter(f_syslog3); destination(d_net_syslog); };
log { source(s_net); filter(f_user); destination(d_net_user); };
log { source(s_net); filter(f_uucp); destination(d_net_uucp); };

log { source(s_net); filter(f_mail); destination(d_net_mail); };
log { source(s_net); filter(f_mail); filter(f_info); destination(d_net_mailinfo); };
log { source(s_net); filter(f_mail); filter(f_warn); destination(d_net_mailwarn); };
log { source(s_net); filter(f_mail); filter(f_err); destination(d_net_mailerr); };

log { source(s_net); filter(f_debug); destination(d_net_debug); };
log { source(s_net); filter(f_error); destination(d_net_error); };
log { source(s_net); filter(f_messages); destination(d_net_messages); };

# Destinations
########################
# First some standard logfile
#
destination d_auth { file("/var/log/auth.log"); };
destination d_cron { file("/var/log/cron.log"); };
destination d_daemon { file("/var/log/daemon.log"); };
destination d_kern { file("/var/log/kern.log"); };
destination d_lpr { file("/var/log/lpr.log"); };
destination d_mail { file("/var/log/mail.log"); };
destination d_syslog { file("/var/log/syslog"); };
destination d_user { file("/var/log/user.log"); };
destination d_uucp { file("/var/log/uucp.log"); };

# This files are the log come from the mail subsystem.
#
destination d_mailinfo { file("/var/log/mail.info"); };
destination d_mailwarn { file("/var/log/mail.warn"); };
destination d_mailerr { file("/var/log/mail.err"); };

# Logging for INN news system
#
destination d_newscrit { file("/var/log/news/news.crit" ); };
destination d_newserr { file("/var/log/news/news.err" ); };
destination d_newsnotice { file("/var/log/news/news.notice" ); };

# Some `catch-all' logfiles.
#
destination d_debug { file("/var/log/debug" ); };
destination d_error { file("/var/log/error" ); };
destination d_messages { file("/var/log/messages" ); };

# The root's console.
#
destination d_console { usertty("root"); };

# Virtual console.
#
destination d_console_all { file(`tty10`); };

# The named pipe /dev/xconsole is for the nsole' utility.  To use it,
# you must invoke nsole' with the -file' option:
#
#    $ xconsole -file /dev/xconsole [...]
#
#destination d_xconsole { pipe("/dev/xconsole"); };

# Send the messages to an other host
#
#destination d_net { tcp("127.0.0.1" port(1000) log_fifo_size(1000)); };

# Debian only
destination d_ppp { file("/var/log/ppp.log" flags(syslog-protocol)); };

########################
# Filters
 
# Here's come the filter options. With this rules, we can set which 
# message go where.

filter f_dbg { level(debug); };
filter f_info { level(info); };
filter f_notice { level(notice); };
filter f_warn { level(warn); };
filter f_err { level(err); };
filter f_crit { level(crit .. emerg); };

filter f_debug { level(debug) and not facility(auth, authpriv, news, mail); };
filter f_error { level(err .. emerg) ; };
filter f_messages { level(info,notice,warn) and
                    not facility(auth,authpriv,cron,daemon,mail,news); };

filter f_auth { facility(auth, authpriv) and not filter(f_debug); };
filter f_cron { facility(cron) and not filter(f_debug); };
filter f_daemon { facility(daemon) and not filter(f_debug); };
filter f_kern { facility(kern) and not filter(f_debug); };
filter f_lpr { facility(lpr) and not filter(f_debug); };
filter f_local { facility(local0, local1, local3, local4, local5,
                        local6, local7) and not filter(f_debug); };
filter f_mail { facility(mail) and not filter(f_debug); };
filter f_news { facility(news) and not filter(f_debug); };
filter f_syslog3 { not facility(auth, authpriv, mail) and not filter(f_debug); };
filter f_user { facility(user) and not filter(f_debug); };
filter f_uucp { facility(uucp) and not filter(f_debug); };

filter f_cnews { level(notice, err, crit) and facility(news); };
filter f_cother { level(debug, info, notice, warn) or facility(daemon, mail); };

filter f_ppp { facility(local2) and not filter(f_debug); };
filter f_console { level(warn .. emerg); };

########################
# Log paths
########################
log { source(s_src); filter(f_auth); destination(d_auth); };
log { source(s_src); filter(f_cron); destination(d_cron); };
log { source(s_src); filter(f_daemon); destination(d_daemon); };
log { source(s_src); filter(f_kern); destination(d_kern); };
log { source(s_src); filter(f_lpr); destination(d_lpr); };
log { source(s_src); filter(f_syslog3); destination(d_syslog); };
log { source(s_src); filter(f_user); destination(d_user); };
log { source(s_src); filter(f_uucp); destination(d_uucp); };

log { source(s_src); filter(f_mail); destination(d_mail); };
log { source(s_src); filter(f_mail); filter(f_info); destination(d_mailinfo); };
log { source(s_src); filter(f_mail); filter(f_warn); destination(d_mailwarn); };
log { source(s_src); filter(f_mail); filter(f_err); destination(d_mailerr); };

log { source(s_src); filter(f_news); filter(f_crit); destination(d_newscrit); };
log { source(s_src); filter(f_news); filter(f_err); destination(d_newserr); };
log { source(s_src); filter(f_news); filter(f_notice); destination(d_newsnotice); };
log { source(s_src); filter(f_cnews); destination(d_console_all); };
log { source(s_src); filter(f_cother); destination(d_console_all); };

log { source(s_src); filter(f_ppp); destination(d_ppp); };

log { source(s_src); filter(f_debug); destination(d_debug); };
log { source(s_src); filter(f_error); destination(d_error); };
log { source(s_src); filter(f_messages); destination(d_messages); };

#log { source(s_src); filter(f_console); destination(d_console_all);
#                                   destination(d_xconsole); };
log { source(s_src); filter(f_crit); destination(d_console); };

# All messages send to a remote site
#
#log { source(s_src); destination(d_net); };

###
# Include all config files in /etc/syslog-ng/conf.d/
###
@include "/etc/syslog-ng/conf.d/*.conf"
                                                                                                                                         
```

**Comment by MrAnno** [comment]
Hi,

The `network()` and `tcp()` drivers don't use framing, that's why the problem can't be seen there.

Please reproduce your issue with plain `syslog()` (wihout tls), for example:
`syslog(ip(0.0.0.0) port(1234) transport("tcp"))` and share your input that causes the problem.
If the issue can't be reproduced with plain TCP, please let us know, it might be a TLS transport bug then.

As I mentioned in https://github.com/syslog-ng/syslog-ng/issues/2958#issuecomment-538108375, the `syslog()` driver requires framing (the format is specified in [RFC6587](https://tools.ietf.org/html/rfc6587)).

**Comment by JanakiRamiReddy** [comment]
Hi MrAnno

I am seeing the same issue with the plain syslog() too.

Oct  4 19:09:31 embd-lnx syslog-ng[9345]: Syslog connection accepted; fd='20', client='AF_INET(10.64.68.209:36045)', local='AF_INET(0.0.0.0:601)'
Oct  4 19:09:31 embd-lnx syslog-ng[9345]: Invalid frame header; header=''
Oct  4 19:09:31 embd-lnx syslog-ng[9345]: Syslog connection closed; fd='20', client='AF_INET(10.64.68.209:36045)', local='AF_INET(0.0.0.0:601)'

**config added:**
source s_net {
syslog(ip(0.0.0.0) port(601)
transport("tcp")
); };

Please help me with my questions

1) In my config file there are 2 source, one for internal and other for remote. 

source s_src {
       system();
       internal();
};

source s_net {
syslog(ip(0.0.0.0) port(6514)
transport("tls")
tls( ca_dir("/etc/syslog-ng/ca.d")
    key_file("/etc/syslog-ng/key.d/privkey.pem")
     cert_file("/etc/syslog-ng/cert.d/cacert.pem")
    peer_verify(optional-untrusted))
); };


2) and have added different destination options for internal and remote. At the remote logs (RFC) I am not seeing any issue after #2958 (comment).

3) Only the issue is seen with the logs in the internal path.

**Comment by MrAnno** [comment]
> Only the issue is seen with the logs in the internal path.

Hm, I don't fully understand that. Your internal `s_src` source contains a `system()` and `internal()` driver. These are local sources, there is no connection to close; they don't produce errors like `Invalid frame header` as far as I know.

**Comment by MrAnno** [comment]
Oh sorry, I think I got you:
The `Invalid frame header` error message can be seen in your local destinations, right?

That's normal, because syslog-ng reports all of its internal errors through the `internal()` source.
But the error message itself was produced because a client (`10.64.68.209:36045`) tried to send logs to port `601` in a format that may not be in the right format.

Could you share the raw input that your clients are sending to the plain TCP `s_net` source?
tcpdump or any other method will do.

**Comment by JanakiRamiReddy** [comment]
Yes Invalid header is seen in my local destinations.

But now I tested without the internal() source.

The only source config I have is as below. But still I am seeing connection failure.
From the tcpdump I am seeing server is sending FIN followed by RST.

source s_net {
syslog(ip(0.0.0.0) port(601)
#syslog(ip(0.0.0.0) port(6514)
transport("tcp")
#tls( ca_dir("/etc/syslog-ng/ca.d")
#    key_file("/etc/syslog-ng/key.d/privkey.pem")
#     cert_file("/etc/syslog-ng/cert.d/cacert.pem")
#    peer_verify(optional-untrusted))
); };

<img width="1485" alt="Screen Shot 2019-10-04 at 7 52 54 PM" src="https://user-images.githubusercontent.com/21256028/66215161-9ba73480-e6e0-11e9-8874-081c3c5a9106.png">

**Comment by JanakiRamiReddy** [comment]
Sorry, 

This is the data sent from 

147 <190>1 2019-10-04T14:05:28.546Z - - - - - BOM%SYS-6-LOGGINGHOST_STARTSTOP: Logging to host 10.64.68.114 port 601 (Mgmt-vrf) started - CLI initiated
96 <189>1 2019-10-04T14:05:45.799Z - - - - - BOM%SYS-5-CONFIG_I: Configured from console by console

**Comment by MrAnno** [comment]
Thanks!
Can you show the payload (these messages) inside Wireshark, so we can see every important byte in the TCP packets?

**Comment by JanakiRamiReddy** [comment]
I hope the can be helpful 

19:32:49.019633 IP 10.64.68.209.43520 > 10.64.68.114.601: tcp 0
        0x0000:  4500 002c 551c 0000 ff06 c8ec 0a40 44d1  E..,U........@D.
        0x0010:  0a40 4472 aa00 0259 6345 3e7d 0000 0000  .@Dr...YcE>}....
        0x0020:  6002 1020 9c27 0000 0204 05b4            `....'......
19:32:49.019659 IP 10.64.68.114.601 > 10.64.68.209.43520: tcp 0
        0x0000:  4500 002c 0000 4000 4006 9d09 0a40 4472  E..,..@.@....@Dr
        0x0010:  0a40 44d1 0259 aa00 e579 7cc9 6345 3e7e  .@D..Y...y|.cE>~
        0x0020:  6012 7210 9de1 0000 0204 05b4            `.r.........
19:32:49.019995 IP 10.64.68.209.43520 > 10.64.68.114.601: tcp 0
        0x0000:  4500 0028 551d 0000 ff06 c8ef 0a40 44d1  E..(U........@D.
        0x0010:  0a40 4472 aa00 0259 6345 3e7e e579 7cca  .@Dr...YcE>~.y|.
        0x0020:  5010 1020 5190 0000                      P...Q...
19:32:50.020725 IP 10.64.68.209.43520 > 10.64.68.114.601: tcp 152
        0x0000:  4500 00c0 551e 0000 ff06 c856 0a40 44d1  E...U......V.@D.
        0x0010:  0a40 4472 aa00 0259 6345 3e7e e579 7cca  .@Dr...YcE>~.y|.
        0x0020:  5010 1020 6ffd 0000 3134 3720 3c31 3930  P...o...147.<190
        0x0030:  3e31 2032 3031 392d 3130 2d30 3454 3134  >1.2019-10-04T14
        0x0040:  3a30 353a 3238 2e35 3436 5a20 2d20 2d20  :05:28.546Z.-.-.
        0x0050:  2d20 2d20 2d20 424f 4d25 5359 532d 362d  -.-.-.BOM%SYS-6-
        0x0060:  4c4f 4747 494e 4748 4f53 545f 5354 4152  LOGGINGHOST_STAR
        0x0070:  5453 544f 503a 204c 6f67 6769 6e67 2074  TSTOP:.Logging.t
        0x0080:  6f20 686f 7374 2031 302e 3634 2e36 382e  o.host.10.64.68.
        0x0090:  3131 3420 706f 7274 2036 3031 2028 4d67  114.port.601.(Mg
        0x00a0:  6d74 2d76 7266 2920 7374 6172 7465 6420  mt-vrf).started.
        0x00b0:  2d20 434c 4920 696e 6974 6961 7465 640a  -.CLI.initiated.
19:32:50.020767 IP 10.64.68.114.601 > 10.64.68.209.43520: tcp 0
        0x0000:  4500 0028 1dad 4000 4006 7f60 0a40 4472  E..(..@.@..`.@Dr
        0x0010:  0a40 44d1 0259 aa00 e579 7cca 6345 3f16  .@D..Y...y|.cE?.
        0x0020:  5010 7540 9ddd 0000                      P.u@....
19:32:50.021199 IP 10.64.68.114.601 > 10.64.68.209.43520: tcp 0
        0x0000:  4500 0028 1dae 4000 4006 7f5f 0a40 4472  E..(..@.@.._.@Dr
        0x0010:  0a40 44d1 0259 aa00 e579 7cca 6345 3f16  .@D..Y...y|.cE?.
        0x0020:  5011 7540 9ddd 0000                      P.u@....
19:32:50.021700 IP 10.64.68.209.43520 > 10.64.68.114.601: tcp 0
        0x0000:  4500 0028 551f 0000 ff06 c8ed 0a40 44d1  E..(U........@D.
        0x0010:  0a40 4472 aa00 0259 6345 3f16 e579 7ccb  .@Dr...YcE?..y|.
        0x0020:  5010 1020 50f7 0000                      P...P...
        0x0050:  fc1a 272b 6d54 b0cd d08b d468 8515 9827  ..'+mT.....h...'
        0x0060:  0499 df21 c243 a7b0 64fc 0547 4328 b128  ...!.C..d..GC(.(
        0x0070:  62e1 d6cd 4c07 d5f0 048f 7daf 81a1 0779  b...L.....}....y
        0x0080:  9570 219b fd4b a0dd 27f7 ea72 7a04 9743  .p!..K..'..rz..C
        0x0090:  8905 c71f d662 ecc3 422b 9360 7b54 e0cd  .....b..B+.`{T..
        0x00a0:  2ef7 12a2 1cef 1b6d 4c07 7518 9de8 5bf4  .......mL.u...[.
        0x00b0:  be1d 40ec c118 903e                      ..@....>
19:33:07.273281 IP 10.64.68.209.43520 > 10.64.68.114.601: tcp 100
        0x0000:  4500 008c 5520 0000 ff06 c888 0a40 44d1  E...U........@D.
        0x0010:  0a40 4472 aa00 0259 6345 3f16 e579 7ccb  .@Dr...YcE?..y|.
        0x0020:  5010 1020 08be 0000 3936 203c 3138 393e  P.......96.<189>
        0x0030:  3120 3230 3139 2d31 302d 3034 5431 343a  1.2019-10-04T14:
        0x0040:  3035 3a34 352e 3739 395a 202d 202d 202d  05:45.799Z.-.-.-
        0x0050:  202d 202d 2042 4f4d 2553 5953 2d35 2d43  .-.-.BOM%SYS-5-C
        0x0060:  4f4e 4649 475f 493a 2043 6f6e 6669 6775  ONFIG_I:.Configu
        0x0070:  7265 6420 6672 6f6d 2063 6f6e 736f 6c65  red.from.console
        0x0080:  2062 7920 636f 6e73 6f6c 650a            .by.console.
19:33:07.273375 IP 10.64.68.114.601 > 10.64.68.209.43520: tcp 0
        0x0000:  4500 0028 527b 4000 4006 4a92 0a40 4472  E..(R{@.@.J..@Dr
        0x0010:  0a40 44d1 0259 aa00 e579 7ccb 0000 0000  .@D..Y...y|.....
        0x0020:  5004 0000 037f 0000                      P.......
19:33:15.586313 IP 10.64.68.209.19022 > 10.64.68.114.601: tcp 0
        0x0000:  4500 002c 2292 0000 ff06 fb76 0a40 44d1  E..,"......v.@D.
        0x0010:  0a40 4472 4a4e 0259 30e3 2c1c 0000 0000  .@DrJN.Y0.,.....
        0x0020:  6002 1020 409d 0000 0204 05b4            `...@.......
19:33:15.586388 IP 10.64.68.114.601 > 10.64.68.209.19022: tcp 0
        0x0000:  4500 002c 0000 4000 4006 9d09 0a40 4472  E..,..@.@....@Dr
        0x0010:  0a40 44d1 0259 4a4e 2428 eaa7 30e3 2c1d  .@D..YJN$(..0.,.
        0x0020:  6012 7210 9de1 0000 0204 05b4            `.r.........
19:33:15.586760 IP 10.64.68.209.19022 > 10.64.68.114.601: tcp 0
        0x0000:  4500 0028 2293 0000 ff06 fb79 0a40 44d1  E..("......y.@D.
        0x0010:  0a40 4472 4a4e 0259 30e3 2c1d 2428 eaa8  .@DrJN.Y0.,.$(..
        0x0020:  5010 1020 4979 0000                      P...Iy..
19:33:15.586856 IP 10.64.68.209.19022 > 10.64.68.114.601: tcp 111
        0x0000:  4500 0097 2294 0000 ff06 fb09 0a40 44d1  E..."........@D.
        0x0010:  0a40 4472 4a4e 0259 30e3 2c1d 2428 eaa8  .@DrJN.Y0.,.$(..
        0x0020:  5010 1020 a645 0000 3130 3620 3c31 3839  P....E..106.<189
        0x0030:  3e31 2032 3031 392d 3130 2d30 3454 3134  >1.2019-10-04T14
        0x0040:  3a30 353a 3439 2e31 3131 5a20 2d20 2d20  :05:49.111Z.-.-.
        0x0050:  2d20 2d20 2d20 424f 4d25 434c 4541 522d  -.-.-.BOM%CLEAR-
        0x0060:  352d 434f 554e 5445 5253 3a20 436c 6561  5-COUNTERS:.Clea
        0x0070:  7220 636f 756e 7465 7220 6f6e 2061 6c6c  r.counter.on.all
        0x0080:  2069 6e74 6572 6661 6365 7320 6279 2063  .interfaces.by.c
        0x0090:  6f6e 736f 6c65 0a                        onsole.
19:33:15.586867 IP 10.64.68.114.601 > 10.64.68.209.19022: tcp 0
        0x0000:  4500 0028 91f0 4000 4006 0b1d 0a40 4472  E..(..@.@....@Dr
        0x0010:  0a40 44d1 0259 4a4e 2428 eaa8 30e3 2c8c  .@D..YJN$(..0.,.
        0x0020:  5010 7210 9ddd 0000                      P.r.....
19:33:15.587057 IP 10.64.68.209.19022 > 10.64.68.114.601: tcp 120
        0x0000:  4500 00a0 2295 0000 ff06 faff 0a40 44d1  E..."........@D.
        0x0010:  0a40 4472 4a4e 0259 30e3 2c8c 2428 eaa8  .@DrJN.Y0.,.$(..
        0x0020:  5018 1020 c11d 0000 3131 3520 3c31 3837  P.......115.<187
        0x0030:  3e31 2032 3031 392d 3130 2d30 3454 3134  >1.2019-10-04T14
        0x0040:  3a30 353a 3530 2e31 3132 5a20 2d20 2d20  :05:50.112Z.-.-.
        0x0050:  2d20 2d20 2d20 424f 4d25 5359 532d 332d  -.-.-.BOM%SYS-3-
        0x0060:  4c4f 4747 494e 4748 4f53 545f 4641 494c  LOGGINGHOST_FAIL
        0x0070:  3a20 4c6f 6767 696e 6720 746f 2068 6f73  :.Logging.to.hos
        0x0080:  7420 3130 2e36 342e 3638 2e31 3134 2070  t.10.64.68.114.p
        0x0090:  6f72 7420 3630 3120 6661 696c 6564 200a  ort.601.failed..
19:33:15.587070 IP 10.64.68.114.601 > 10.64.68.209.19022: tcp 0
        0x0000:  4500 0028 91f1 4000 4006 0b1c 0a40 4472  E..(..@.@....@Dr
        0x0010:  0a40 44d1 0259 4a4e 2428 eaa8 30e3 2d04  .@D..YJN$(..0.-.
        0x0020:  5010 7210 9ddd 0000                      P.r.....
19:33:15.587234 IP 10.64.68.114.601 > 10.64.68.209.19022: tcp 0
        0x0000:  4500 0028 91f2 4000 4006 0b1b 0a40 4472  E..(..@.@....@Dr
        0x0010:  0a40 44d1 0259 4a4e 2428 eaa8 30e3 2d04  .@D..YJN$(..0.-.
        0x0020:  5011 7210 9ddd 0000                      P.r.....
19:33:15.587405 IP 10.64.68.209.19022 > 10.64.68.114.601: tcp 0
        0x0000:  4500 0028 2296 0000 ff06 fb76 0a40 44d1  E..("......v.@D.
        0x0010:  0a40 4472 4a4e 0259 30e3 2d04 2428 eaa9  .@DrJN.Y0.-.$(..
        0x0020:  5010 1020 4891 0000                      P...H...
    19:33:16.587117 IP 10.64.68.209.19022 > 10.64.68.114.601: tcp 151
        0x0000:  4500 00bf 2297 0000 ff06 fade 0a40 44d1  E..."........@D.
        0x0010:  0a40 4472 4a4e 0259 30e3 2d04 2428 eaa9  .@DrJN.Y0.-.$(..
        0x0020:  5010 1020 71aa 0000 3134 3620 3c31 3930  P...q...146.<190
        0x0030:  3e31 2032 3031 392d 3130 2d30 3454 3134  >1.2019-10-04T14
        0x0040:  3a30 353a 3535 2e31 3134 5a20 2d20 2d20  :05:55.114Z.-.-.
        0x0050:  2d20 2d20 2d20 424f 4d25 5359 532d 362d  -.-.-.BOM%SYS-6-
        0x0060:  4c4f 4747 494e 4748 4f53 545f 5354 4152  LOGGINGHOST_STAR
        0x0070:  5453 544f 503a 204c 6f67 6769 6e67 2074  TSTOP:.Logging.t
        0x0080:  6f20 686f 7374 2031 302e 3634 2e36 382e  o.host.10.64.68.
        0x0090:  3131 3420 706f 7274 2036 3031 2028 4d67  114.port.601.(Mg
        0x00a0:  6d74 2d76 7266 2920 7374 6172 7465 6420  mt-vrf).started.
        0x00b0:  2d20 7265 636f 6e6e 6563 7469 6f6e 0a    -.reconnection.

**Comment by JanakiRamiReddy** [comment]
<img width="934" alt="Screen Shot 2019-10-04 at 8 18 18 PM" src="https://user-images.githubusercontent.com/21256028/66217024-29d0ea00-e6e4-11e9-8214-4fc85bef76a4.png">

**Comment by MrAnno** [comment]
Perfect. Thanks.

So the problem is that every message contains a newline character, it is `0a` in hex:
```
        0x0020:  3134 3720 3c31 3930                      147.<190
        0x0030:  3e31 2032 3031 392d 3130 2d30 3454 3134  >1.2019-10-04T14
        0x0040:  3a30 353a 3238 2e35 3436 5a20 2d20 2d20  :05:28.546Z.-.-.
        0x0050:  2d20 2d20 2d20 424f 4d25 5359 532d 362d  -.-.-.BOM%SYS-6-
        0x0060:  4c4f 4747 494e 4748 4f53 545f 5354 4152  LOGGINGHOST_STAR
        0x0070:  5453 544f 503a 204c 6f67 6769 6e67 2074  TSTOP:.Logging.t
        0x0080:  6f20 686f 7374 2031 302e 3634 2e36 382e  o.host.10.64.68.
        0x0090:  3131 3420 706f 7274 2036 3031 2028 4d67  114.port.601.(Mg
        0x00a0:  6d74 2d76 7266 2920 7374 6172 7465 6420  mt-vrf).started.
        0x00b0:  2d20 434c 4920 696e 6974 6961 7465 640a  -.CLI.initiated.
```

The message here is the following:
```
<190>1.2019-10-04T14:05:28.546Z.-.-.-.-.-.BOM%SYS-6-LOGGINGHOST_STARTSTOP:.Logging.to.host.10.64.68.114.port.601.(Mgmt-vrf).started.-.CLI.initiated.
```

This is 148 bytes counting the newline character at the end, but your client specified 147 instead as the message length.

Because of this, syslog-ng has read 147 bytes and then tried to read the next message header, but there was a newline character at the position of the 148th byte instead of the next message frame.


Here is another one:
```
        0x0020:  5010 1020 08be 0000 3936 203c 3138 393e  P.......96.<189>
        0x0030:  3120 3230 3139 2d31 302d 3034 5431 343a  1.2019-10-04T14:
        0x0040:  3035 3a34 352e 3739 395a 202d 202d 202d  05:45.799Z.-.-.-
        0x0050:  202d 202d 2042 4f4d 2553 5953 2d35 2d43  .-.-.BOM%SYS-5-C
        0x0060:  4f4e 4649 475f 493a 2043 6f6e 6669 6775  ONFIG_I:.Configu
        0x0070:  7265 6420 6672 6f6d 2063 6f6e 736f 6c65  red.from.console
        0x0080:  2062 7920 636f 6e73 6f6c 650a            .by.console.
```

This is `96.<189>1.2019-10-04T14:05:45.799Z.-.-.-.-.-.BOM%SYS-5-CONFIG_I:.Configured.from.console.by.console.`, but the correct length is 97, not 96.

**Comment by JanakiRamiReddy** [comment]
Thanks MrAnno, will change the Len and verify.

**Comment by JanakiRamiReddy** [comment]
Thanks MrAnno for helping to understand the issue and it is good learning too.
